{
  "$schema": "https://example.invalid/trimui-compat-recipe-v1.schema.json",
  "apiVersion": 1,
  "configDelta": [
    {
      "key": "core.audio.volume",
      "value": {
        "kind": "integer",
        "value": 80
      }
    }
  ],
  "core": {
    "id": "clean-room-gameboy-lab-core",
    "versionConstraint": "=1.0.0"
  },
  "format": "trimui-compatibility-recipe",
  "kind": "compatibility-recipe",
  "knownIssues": [
    "Synthetic blocked-core rejection"
  ],
  "profiles": {
    "displayProfileId": "tg4040-default",
    "inputProfileId": "default",
    "powerProfileId": "balanced"
  },
  "romSha256": "aaaaaaaaaaaaaaaaaaaaaaaaaaaaaaaaaaaaaaaaaaaaaaaaaaaaaaaaaaaaaaaa",
  "schemaVersion": 1,
  "systemId": "tg4040",
  "targetId": "recipe-blocked-core",
  "targetSku": "TG4040"
}
